Category,QuestionNumber,ExamRecord,Question,A,B,C,D,E,Answer,Explanation
基礎疼痛機制,31,"109年第1次第7題, 109年第2次第7題",Which one of the following statements is wrong?,"The spinal dorsal horn receives input from a wide variety of primary afferent axons, including nociceptors, which respond to tissue-damaging stimuli from the skin, muscles, joints, and viscera.",The patterns of termination of primary afferents within the spinal cord are related to axonal diameter and receptive field modality.,"Most nociceptive primary afferents have slowly conducting fine myelinated or unmyelinated axons, and they terminate mainly in the deep part of the dorsal horn.",Primary afferents release a variety of chemical mediators and on entering the dorsal horn they form excitatory synapses with neurons located within it.,,C,大部分傷害接受性初級傳入纖維主要終止於脊髓背角的淺層部分（lamina I和II），而非深層。這些細有髓鞘或無髓鞘軸突雖然傳導速度較慢，但它們在背角的終止模式有其特定分布。Lamina I和II（substantia gelatinosa）是疼痛信號處理的主要區域。深層的lamina V主要接受來自粗有髓鞘纖維的輸入。
基礎疼痛機制,32,110年第48題,Which one of the following statement about central pain is wrong?,Central pain involves plasticity in a single area of CNS.,"Sensitization of the CNS plays a major role in central pain and involves neuronal hyper-excitability resulting in an increased response to synaptic inputs, decreased threshold, expansion of receptive fields, and access of low-threshold Aβ mechanoreceptors to pain pathways.","The clinical consequences of central pain are allodynia, hyperalgesia, and after-sensations.",Central sensitization may also include spontaneous discharges.,Spontaneous discharges in damaged pain pathways or deafferented rostral neurons may be responsible for spontaneous ongoing or intermittent pain.,A,**錯誤** - 中樞痛不僅限於CNS的單一區域，而是涉及多個區域的可塑性改變，這是中樞敏化的核心特徵。
基礎疼痛機制,33,110年第50題,"見下圖，不同的傷害性刺激（熱 Heat、酸或化學性 Acid/Chemical、機械性刺激 Mechanical、冷 Cold）所興奮的表皮傷害性接受器（1, 2, 3, 4），可對應左側四組 A, B, C, D，按 1, 2, 3, 4 正確排列依序為：\n\n（參考 Bonica's Management of Pain 5th Ed, Chapter 2, Figure 3.1-B）\n\n四組受器分別為：\nA組：TRPV1, TRPV2, TRPV3, TRPV4（熱敏感受器）\nB組：ASIC, TRPV1（酸/化學敏感受器）\nC組：Piezo2, TRPA1（機械敏感受器）\nD組：TRPM8, TRPA1（冷敏感受器）","A, B, C, D","A, C, B, D","B, C, A, D","C, B, D, A","D, C, B, A",A,正確答案。按照刺激類型的對應關係：1號熱刺激對應A組TRPV1-4熱敏感受器、2號酸/化學刺激對應B組ASIC和TRPV1、3號機械刺激對應C組Piezo2和TRPA1、4號冷刺激對應D組TRPM8和TRPA1。這個排列完全符合各種傷害性接受器的生理功能特性，是疼痛訊號轉導的正確配對。
基礎疼痛機制,34,111年第16題,The criteria to classify a neuron as a nociceptor include:,"The presence or absence of axon myelination, cell size, and/or cell content (e.g., peptide or ion channel) as well as central termination pattern.","Sensory neurons commonly identified as nociceptors are those with unmyelinated (C-fiber) axons, small cell body diameters (<20 or 25 μm), that terminate in the superficial layers of the spinal cord dorsal horn.","The presence or absence of certain markers (e.g., the tetrodotoxin (TTX)-resistant sodium channel NaV1.8, the transient receptor potential vanilloid receptor TRPV1) have been used to identify subsets of nociceptors.","More recently, with the ability to analyze many genes expressed in a single cell, patterns of gene expression have been used to further define subpopulations of nociceptors.",All of the above.,E,**正確** - 前面所有選項都是正確的，這些標準共同構成了完整的傷害性感受器分類框架。
基礎疼痛機制,35,111年第17題,Which one of the following statement is wrong?,"The spinal cord and brainstem nuclei are home to second-order neurons, the first step of central nervous system (CNS) processing.","A proto-oncogene, c-fos, is activated after potentially tissue-damaging stimuli are applied to most tissues.",A systematic comparison study of Fos and pERK as markers of spinal nociceptive activation revealed greater specificity for activity in nociceptive pathways (vs. non-nociceptive activation) using Fos.,"The spinal cord is segregated into areas that, on gross examination, appear as white and grey matter and consist of predominantly myelinated nerve fiber tracts and cell bodies, respectively.","Using Rexed's cytoarchitecture-based classification system, there are at least 10 different layers or laminae of neurons—of which the first six (I to VI) are termed the dorsal horn of the spinal cord.",C,**錯誤** - pERK對傷害性路徑的特異性更高，而不是Fos，這是因為pERK的活化更能反映神經元的即時反應。
基礎疼痛機制,36,111年第18題,Which one of the following statement is correct?,Changes in excitability occur in second-order neurons when repetitive or prolonged high-intensity input is received from primary afferent C-fibers.,A characteristic of spinal nociceptive systems is that they are under tonic descending inhibition such that a common effect of injury to spinal pathways is a release from this inhibition.,"The midbrain periaqueductal grey (PAG) and the rostral ventral medulla (RVM), in particular the medullary nucleus raphe magnus (NRM) figured prominently in the original analyses of descending modulation of pain.","Stimulation of both somatosensory cortex (SSC) and motor cortex (MC) have been used in the clinical treatment of neuropathic pain, central poststroke pain, and phantom limb pain.",All of the above are correct.,E,此選項為正確答案。前述所有選項(A、B、C、D)的描述都是正確的疼痛神經科學概念。選項A描述中樞敏感化機制、選項B闡述下行抑制系統、選項C說明疼痛調節的神經解剖基礎、選項D描述神經調節治療的臨床應用。這些都是現代疼痛醫學的重要理論基礎和治療原理，每個概念都有充分的科學證據支持，因此「以上皆正確」是最適當的答案。
基礎疼痛機制,37,"111年第41題, 113年第6題",Which one of the following statement is correct?,"Functional imaging techniques applied for the study of pain are positron emission tomography (PET), functional magnetic resonance imaging (fMRI), near-infrared spectroscopy (NIRS), multi-channel electroencephalography (EEG) and magnetoencephalography (MEG), and intracranial recordings.",NIRS is an optical approach that also analyses changes in hemoglobin oxygenation levels by using light in the near infrared range (650 to 950 nm).,"EEG and MEG are noninvasive neurophysiologic techniques that measure the respective electrical potentials and magnetic fields generated by neuronal activity of the brain and propagated to the surface of the skull where they are picked up with EEG electrodes or, in the case of its magnetic counterpart, received by supra conducting quantum interference device (SQUID) sensors located outside the skull.","Invasive recordings, which are assessed during neurosurgical interventions in patients ongoing epileptic surgery, or deep brain stimulation (DBS) procedures (most common in Parkinson disease), are extremely helpful to directly measure supraspinal pain signals.",All of the above are correct.,E,此選項為正確答案。前述A、B、C、D選項都準確描述了各種疼痛研究技術的特點和應用。每種技術都有其獨特的優勢：影像學技術提供空間定位資訊，電生理技術提供時間動態資訊，侵入性記錄提供高解析度的直接測量。這些技術的整合應用，構成了現代疼痛神經科學研究的技術基礎，使我們能夠從多個角度深入理解疼痛的複雜機制。
基礎疼痛機制,37,112年第2題,Which one of the following nociceptors is confirmed by microneurography with psychophysical experiments?,"Rapidly adapting (flutter, vibration) and slowly adapting (pressure) cutaneous mechanoreceptors",Aδ-mechanonociceptors (AM [mechano]; sharp pain),"C-polymodal nociceptors (CM [mechano] H[heat]; dull, burning [heat] pain)",Muscle nociceptors (cramping pain),All of the above,E,這是正確答案。所有上述類型的感受器（快速和慢速適應性皮膚機械感受器、Aδ-機械傷害感受器、C-多模態傷害感受器，以及肌肉傷害感受器）都已透過microneurography結合心理物理學實驗得到證實。這項技術的發展使研究者能夠直接記錄人體不同類型感受器的活動，並建立神經活動與主觀疼痛感覺之間的因果關係，為我們理解疼痛的神經生理機制提供了重要的實驗證據。
內臟痛與特殊疼痛,1,102年第20題,Choice a right description about acute pain associated with chemotherapy toxicity.,Intraperitoneal chemotherapy seldom induces abdominal pain.,Vincristine treatment can induce peripheral neuropathy.,Intrathecal methotrexate produces an acute menigitic syndrome in 80% of patients,5-fluorouracil (5-FU) produces peripheral neuropathy but no chest pain.,None of above is right.,B,Vincristine是一種抗癌藥物，屬於植物生物鹼類，常用於治療多種癌症。其主要副作用之一是劑量相關的周邊神經病變，這是因為Vincristine會干擾微管的形成，影響神經元的正常功能，導致感覺和運動神經的損傷，患者可能會出現四肢麻木、刺痛或肌肉無力等症狀。
內臟痛與特殊疼痛,2,"103年第44題, 104年第12題",A 61-year-old woman presents to the pain clinic with a chief complaint of left shoulder and arm pain 3 years after undergoing radiation therapy for breast cancer. Physical examination reveals lymphedema of the left axilla with noticeable skin changes. Examination of the left supraclavicular area precipitates a sharp pain that radiates down her left arm. Which of the following is her likely diagnosis?,Tumor metastasis,Cervical radiculopathy,Reflex sympathetic dystrophy,Thromboangiitis obliterans,Radiation-induced plexopathy,E,放射性臂神經叢病變是放射治療後的常見併發症，特別是在乳癌治療中。放射線會對神經組織造成直接損傷，導致神經纖維的退化和纖維化，進而引起疼痛、麻木和運動功能障礙。患者的症狀如肩膀和手臂疼痛、淋巴水腫和皮膚變化，符合放射性臂神經叢病變的典型表現。
內臟痛與特殊疼痛,3,103年第49題,"As we know, bone scan is the most common diagnostic tool for bone metastasis. Which limitation is incorrect?",Bone scan is characterized by high sensitivity and high specificity,Any positive findings should be corresponded to painful sites with further evaluation of CT or plain radiographs,Bone scan doesn't evaluate the structural integrity,"Most common pattern of metastasis in bone scan is ""hot spot"" with radioisotope accumulation for new bone reaction","Some cancers may not show ""hot spot"" pattern, such as melanoma and multiple myeloma",A,骨掃描雖然具有高敏感度，能夠檢測到骨骼的病理變化，但其特異性較低，容易出現偽陽性結果。這是因為骨掃描的異常信號可能由多種非腫瘤性病變引起，如骨折、感染或關節炎，因此需要進一步的影像學檢查來確認診斷。
內臟痛與特殊疼痛,4,"107年第3次第21題, 109年第1次第49題, 109年第2次第49題",Which of the following combination of lesion site with referral site describing pain referral is not common in cancer patients suffering from cancer pain?,(Diaphragmatic irritation) and (Shoulder),(Urothelial tract) and (Inguinal region and genitalia),(C7–T1 vertebrae) and (Interscapular),(L1–2) and (Sacroiliac joint and hip),all of the above are common found in patients with cancer pain,E,所有列出的疼痛轉移模式在癌症患者中都是常見的，這是因為內臟和體表的神經信號在脊髓中會發生匯聚，導致內臟疼痛被感知為體表疼痛，這種現象稱為轉移痛。
內臟痛與特殊疼痛,5,"108年第1次第33題, 108年第2次第33題, 109年第1次第23題, 109年第2次第23題",Which of the following is not true about the properties of visceral pain?,It is diffuse in character and poorly localized.,It is typically referred rather than being felt at the source.,It is produced by stimuli different from those adequate for activation of somatic nociceptors.,Distention of hollow organs may induce adequate stimuli for production of visceral pain.,It is associated with emotional and autonomic responses but much less than those associated with somatic pain.,E,內臟疼痛通常伴隨著強烈的情緒和自主神經反應，如噁心、嘔吐、出汗等，這是因為內臟疼痛涉及到更複雜的神經機制和中樞神經系統的廣泛參與，這些反應往往比體感疼痛更為顯著。
內臟痛與特殊疼痛,6,"108年第1次第35題, 108年第2次第35題, 109年第1次第24題, 109年第2次第24題, 112年第13題",Which of the following is not true about chronic pelvic pain without pathology (CPP)?,CPP is defined as non-menstrual pelvic pain of 6 or more months' duration that is severe enough to cause functional disability or to require medical or surgical treatment.,CPP is common and estimated to account for 40% of all gynecologic diagnostic laparoscopies.,A history of childhood physical and/or sexual abuse has been correlated with the development of CPP.,The best evidence-based management of patients with CPP is multidisciplinary care.,All of the answers above are correct.,E,所有選項A-D的描述都是關於慢性骨盆疼痛的正確資訊。CPP的定義、流行病學數據、與童年創傷的相關性以及多專科團隊照護的管理策略，皆為目前醫學界所接受的事實。
內臟痛與特殊疼痛,7,"109年第1次第18題, 109年第2次第18題",Which of the following site of lesion with its referral site of pain is not common?,Diaphragmatic irritation with Shoulder,Urothelial tract with Inguinal region and genitalia,L1–2 with Sacroiliac joint and hip,Pharynx with Ipsilateral ear,all of the above are common patterns of pain referral,E,所有列出的疼痛轉移模式都是臨床上常見的，這是因為內臟和體表的神經信號在脊髓中匯聚，導致內臟疼痛被感知為體表疼痛，這種現象稱為轉移痛。
內臟痛與特殊疼痛,8,"109年第1次第35題, 109年第2次第35題",下列關於原發性口腔灼熱症候群(burning mouth syndrome)的描述，何者為非?,症狀局限於舌頭處,表現灼熱及感覺異常,常伴隨味覺功能障礙,涉及對感覺神經元和自主神經元的損害,藥物治療包含三環類抗抑鬱藥、抗癲癇藥或鴉片類藥物,A,錯誤，症狀可擴及整個口腔，不僅限於舌頭，這是因為涉及多個感覺神經的異常。
內臟痛與特殊疼痛,9,113年第39題,下列有關鑑別 retroperitoneal cancer 造成 back pain 的 Retroperitoneal pain stretch maneuver 何者錯誤?,病人於病床 sit upright 後逐漸將床放平,可以考慮於膝蓋下置放枕頭增加診斷率,有時需要放平數分鐘後疼痛才會逐漸增強,需先排除病患的背痛來源是 spine 或 paraspinal muscle,此類病人常抱怨無法躺平睡覺,B,錯誤，膝下放枕頭會減少張力，降低診斷率，因為這樣的姿勢會減少對後腹膜的壓迫。
脊椎疼痛與背痛,1,"102年第21題, 106年第1次第20題, 107年第1次第13題, 107年第3次第13題, 108年第1次第25題, 108年第2次第25題, 112年第11題","About the failed back surgery syndrome (FBSS), which one of the following procedure may be the last to be considered due to possible poor response?",caudal steroids injection,epidural adhesive lysis,spinal cord stimulation,radiofrequency denervation,lumbar sympathetic block,E,腰部交感神經阻斷術 (lumbar sympathetic block) 主要用於治療下肢的交感神經相關疼痛，如CRPS、周邊血管疾病或幻肢痛等。FBSS的疼痛機轉主要涉及體感神經系統的發炎、纖維化和神經損傷，而非交感神經功能異常。因此，腰部交感神經阻斷術對FBSS的治療效果通常很差，臨床反應不佳，是最後才會考慮的治療選項。
脊椎疼痛與背痛,2,"103年第6題, 106年第1次第21題, 107年第1次第14題, 107年第3次第14題, 108年第1次第46題, 108年第2次第46題, 111年第7題, 112年第41題, 114年第26題","A patient suffered from chronic low back pain with radiating to buttock, poster lateral thigh and lateral aspect of lower leg. Muscle weakness was observed in the extensor hallucis longus and tibialis anterior. Which lumbosacral root compression is the most likely?",L2 root compression,L3 root compression,L4 root compression,L5 root compression,S1 root compression,D,L5神經根壓迫完全符合本病例的臨床表現，這是正確答案。L5神經根支配拇長伸肌(extensor hallucis longus)和脛前肌(tibialis anterior)，負責足背屈和拇趾背屈功能。L5神經根的感覺分布區域(dermatome)包括臀部、大腿後外側、小腿外側及足背，與患者的疼痛放射模式完全一致。L5神經根壓迫是腰椎間盤突出症中最常見的類型，典型症狀包括腰痛合併坐骨神經痛、足背屈無力、拇趾背屈無力等。
脊椎疼痛與背痛,3,"103年第13題, 104年第13題",When will you make a surgical suggestion as you manage a patient with neck or low back pain?,Intractable symptoms for one week,No changes in physical findings and no response to conservative management for two weeks,Obvious radicular sign without findings of correctable anatomical problem for more than one month,No improvement with progressive neurologic deficit in two weeks,Mild improvement for more than one month but less than three months,D,這是正確答案。進行性神經學缺損是手術的緊急適應症，即使在保守治療的早期階段（兩週內）也應該考慮手術介入。進行性神經學缺損表示神經壓迫持續惡化，可能導致永久性神經損傷。常見的進行性缺損包括肌力持續下降、感覺功能惡化、反射異常加重等。這種情況下，及時的外科減壓可以防止不可逆的神經損傷，改善長期預後。
脊椎疼痛與背痛,4,103年第27題,"A patient had chronic pain over the neck, medial scapula, anterior chest, medial aspect of arm and forearm. Horner's syndrome was also noted. Which root compression is the most likely?",C5 root compression,C6 root compression,C7 root compression,C8 root compression,T1 root compression,E,T1神經根壓迫是正確答案。T1皮節分布於前胸、上臂內側和前臂內側，完全符合題目描述的疼痛分布模式。T1神經根的解剖位置靠近胸廓入口，壓迫時容易同時影響附近的stellate ganglion(星狀神經節)或上胸部交感神經鏈，導致同側Horner's syndrome的出現。這種組合症狀(T1皮節疼痛加上Horner's syndrome)是胸廓出口症候群或T1神經根壓迫的典型表現。T1神經根病變還可能伴隨手部內側肌群無力和感覺異常，形成完整的臨床症候群。
脊椎疼痛與背痛,5,103年第40題,"The current guidelines on the management of acute low back pain in primary care include the following, EXCEPT:",Reassure patients because the prognosis is most favorable,Advise or encourage complete bed rest,Prescribe analgesics medication if necessary,Encourage to stay active,Consider spinal manipulation (chiropractic) for pain relief,B,此選項錯誤，為正確答案。建議完全臥床休息已不符合現代急性下背痛處置指引。研究證實長期臥床休息會導致肌肉萎縮、骨質流失、心肺功能下降，並可能延緩復原過程。現代指引建議患者應盡早恢復日常活動，避免超過1-2天的臥床休息，以促進組織修復和防止慢性化。
脊椎疼痛與背痛,6,103年第45題,"A 26-year-old weight lifter felt a sharp pain in the neck, radiating to the dorsal aspect of the forearm during his workout. Over the next few days he noted progressive numbness of the thumb and index finger. He also complained of decreased ability to perform bicep curls. On examination by his primary care doctor, a markedly diminished biceps reflex was found. Which of the following is the most likely cause of the patient's problem?",Facture C5 vertebra,C5-C6 disc protrusion,Facet syndrome at C5-6,Compression of the C5 nerve root by an osteophyte,,B,C5-C6椎間盤突出是最可能的原因。患者的症狀包括拇指和食指麻木、二頭肌無力、二頭肌反射明顯減弱，這些都符合C6神經根受壓的典型表現。椎間盤突出是年輕運動員最常見的頸椎神經根病變原因，特別是在重量訓練時突然發生的急性症狀。C5-C6是頸椎最容易發生椎間盤突出的部位之一。
脊椎疼痛與背痛,7,105年第5題,"Examination of a patient with neck and shoulder pain reveals referred pain in the lateral aspect of the forearm, with weakness and dysfunction of the biceps and brachioradialis, and hypoesthesia in the lateral aspect of the forearm and thumb. The patient most likely has a lesion of which nerve root?",C4,C5,C6,C7,,C,患者的症狀符合C6神經根病變的典型表現。C6神經根支配二頭肌和肱橈肌，其感覺分布包括前臂外側和拇指區域。當C6神經根受損時，會出現這些肌肉的無力、相應區域的感覺減退，以及可能的二頭肌反射減弱。前臂外側疼痛是C6皮節分布的特徵性表現。
脊椎疼痛與背痛,8,105年第21題,Which of the following activities will exacerbate pain the most in an elderly patient with severe spinal stenosis?,Walking uphill,Walking downhill,Riding a bicycle,Bending forward Standing,,B,下坡行走會最大程度地加重脊椎狹窄患者的疼痛。下坡行走時，腰椎會處於相對伸展的姿勢，這會進一步縮小已經狹窄的椎管空間，增加對神經結構的壓迫。脊椎狹窄的典型症狀是神經性跛行，患者在行走時出現下肢疼痛和麻木，而伸展姿勢會使症狀惡化。相反地，前彎姿勢（如騎自行車或前傾行走）會擴大椎管空間，緩解症狀。
脊椎疼痛與背痛,9,105年第48題,"All if the following are red flags in patients with low back pain, EXCEPT:",History of prolonged corticosteroid use,Saddle anesthesia,Age of 36 years,Urine retention,Bowel incontinence,C,36歲年齡本身不是紅旗警示徵象，這是正確答案。年齡相關的紅旗警示徵象是指小於20歲或大於50歲。小於20歲的下背痛需要考慮脊椎側彎、感染或腫瘤等可能性；大於50歲則需要警惕惡性腫瘤、骨質疏鬆性骨折等風險增加的疾病。36歲正值中年，是非特異性下背痛的常見發病年齡，多與生活方式、工作姿勢不良或肌肉骨骼退化有關。這個年齡層的下背痛通常是良性的機械性疼痛，除非伴隨其他紅旗警示徵象，否則不需要特殊檢查。
脊椎疼痛與背痛,10,"108年第1次第30題, 108年第2次第30題",下列有關慢性下背痛之保守治療效果，針對短週期緩解疼痛效果而言，依系統性回顧，下列何者最差？,Acupuncture,NSAIDs analgesics,Opioids analgesics,Low-level Laser therapy,TENS (Transcutaneous Electrical Nerve Stimulation),E,經皮電神經刺激(TENS)是正確答案，其短週期疼痛緩解效果在所列選項中最差。TENS的作用原理基於閘門控制理論，透過電刺激粗纖維神經來抑制疼痛訊號傳遞。然而，多項高品質的系統性回顧和隨機對照試驗顯示，TENS對慢性下背痛的療效證據薄弱，特別是在短期疼痛緩解方面效果有限。許多研究發現TENS與安慰劑治療相比沒有顯著差異，因此在實證醫學證據上支持度最低。
脊椎疼痛與背痛,11,110年第31題,epidural steroid injection 治療邏輯是針對椎間盤 nucleus pulposus 所釋放的發炎物質，下列數種發炎物質何者與椎間盤突出最沒有直接相關性？,phospholipase A2,caspase,"interleukins ( 1α, 1β, 6)",tumor necrosis factor,nitric oxide,B,Caspase是一群參與細胞凋亡(apoptosis)的蛋白酶，主要功能是執行程序性細胞死亡。雖然在慢性神經病變或神經退化過程中可能參與，但在椎間盤突出的急性發炎反應中並非主要角色。椎間盤突出主要是機械性壓迫合併化學性發炎反應，而非細胞凋亡過程，因此caspase與椎間盤突出最沒有直接相關性，這是正確答案。
脊椎疼痛與背痛,12,110年第35題,Which of the following statement is true?,The most common cause of low back pain is disc herniation.,The most common cause of low back pain is lumbar spinal stenosis.,The most common cause of low back pain is spondylolisthesis.,The most common cause of low back pain is nonspecific.,The most common cause of low back pain is facet joint pain.,D,非特異性下背痛(nonspecific low back pain)是下背痛最常見的類型，約佔85-90%。這類患者經過適當的評估後，無法找到明確的結構性病變或特定疾病。疼痛可能源自多種結構，包括肌肉、筋膜、韌帶、椎間盤、小面關節等的組合。診斷主要基於排除特異性病因和紅旗症狀(red flags)後的臨床判斷。
