Category,QuestionNumber,ExamRecord,Question,A,B,C,D,E,Answer,Explanation
鴉片類藥物,1,"102年第5題, 104年第50題",Choice a right equianalgesic factors compared to subcutaneous morphine.,Morphine (oral) 0.50,Codeine (oral) 0.20,Alfentanil (subcutaneous) 1.0,Oxycodone (parenteral) 5.0,None of above is right.,E,所有提供的等效止痛劑量換算係數均不符合臨床實際標準。這些係數應根據臨床經驗和研究數據進行調整，考慮到藥物的生物利用率、代謝途徑和患者的個體差異。根據Perplexity研究資料，等效劑量換算表僅提供一般估計，應用時需謹慎，以避免過量或治療不足。
鴉片類藥物,2,"102年第17題, 106年第1次第1題, 108年第1次第22題, 108年第2次第22題","Which opioid described below belong to ""full agonist""?",buprenorphine,fentanyl,nalbuphine,butorphanol,naltrexone,B,Fentanyl是μ-opioid受體的完全致效劑（full agonist），具有完整的受體激活能力。這意味著它能夠最大程度地激活受體，提供強效的止痛效果，常用於需要高效止痛的臨床情境，如手術後或癌症疼痛。
鴉片類藥物,3,102年第38題,Which of the following is Wrong?,"Opioids activate central μ opioid receptor which causing decreased peristalsis, decreased intestinal secretions, and increased sphincter tone.",Pain act as a physiologic antagonist to respiratory depression.,Up to two-thirds of patients experience nausea or vomiting during initiation of opioid therapy.,"Antihistamines, opioid antagonists, propofol and ondansetron have been used for the treatment of pruritus.",,A,選項A是錯誤的，因為鴉片類藥物主要作用於腸道局部的μ鴉片受體，而非中樞的μ鴉片受體來產生便秘效果。腸道內有豐富的μ鴉片受體分布，鴉片類藥物直接作用於腸道的這些受體，導致腸蠕動減少、腸道分泌減少和括約肌張力增加。這種腸道副作用主要是周邊作用機制，而非中樞神經系統的作用結果。
鴉片類藥物,4,102年第50題,Therapeutic plasma concentrations of a passive fentanyl patch 多於貼上皮膚後多久達成？,< 2 hours,< 4 hours,< 8 hours,< 12 hours,12-24 hours,E,Fentanyl貼片需要12-24小時才能達到治療血漿濃度，這是因為皮膚吸收的延遲時間。貼片中的藥物需先在皮膚表層形成藥物庫，再逐漸進入系統循環，這種緩慢釋放機制有助於維持穩定的血藥濃度。
鴉片類藥物,5,"103年第2題, 104年第16題, 106年第1次第15題, 107年第1次第9題, 107年第3次第9題, 108年第1次第50題, 108年第2次第50題","Based on clinical situations, which kind of opioids owns the highest oral bioavailability?",Hydromorphone,Morphine,Pethidine (meperidine),Oxycodone,Tramadol,E,Tramadol的口服生物利用率約為70-80%，在常用鴉片類藥物中最高。這意味著口服給藥後，較大比例的藥物能進入系統循環，提供有效的止痛效果，並且其代謝產物也具有止痛作用。
鴉片類藥物,6,"103年第32題, 104年第37題, 111年第46題, 113年第10題","Regarding the actions of spinal and supraspinal analgesia for opioids, which of the following statement is most likely:",Opioid receptors are mostly located at a predominantly 70% postsynaptic location on the central terminals of only small diameter nociceptive primary afferents.,"The contribution of kappa, delta and mu receptors to the total opiate binding throughout the spinal cord is estimated to be delta > mu >kappa.",Opioids inhibit OFF cells via GABA neurons and activate ON cells in the rostromedial medulla (RVM) leading to changes in spinal descending controls.** (103年、104年答案),Nitric oxide (NO) is required for the 5-HT-mediated inhibition of PAG output and reversal of antinociception.** (111年答案),"Fibers descending from the PAG to the dorsal horn of the spinal cord are mostly enkephalinergic, glycinergic and GABAergic.** (113年答案)",E,此選項正確。從中腦導水管周圍灰質(PAG)下行至脊髓背角的纖維主要是腦啡肽能(enkephalinergic)、甘胺酸能(glycinergic)和GABA能(GABAergic)神經纖維。這些抑制性神經傳導物質構成了內源性鎮痛系統的主要效應分子。腦啡肽作為內源性鴉片肽，直接激活脊髓的鴉片受體；甘胺酸和GABA作為主要的抑制性胺基酸神經傳導物質，透過超極化神經元膜電位來抑制傷害性訊號的傳遞。這種多重抑制機制確保了PAG下行通路的強效鎮痛作用。
鴉片類藥物,7,104年第5題,關於鴉片類藥物的敘述，以下何者最為正確？,嗎啡可能使肥胖細胞（mast cell）釋放組織胺（histamine）,Methadone 具有 NMDA 受體拮抗劑的特性，且不會被 naloxone 拮抗,鴉片類藥物作用在腦幹會降低呼吸中樞對缺氧（low PO2）的敏感性,使用鴉片類藥物造成便秘是屬於中樞性副作用（central side effect）,嗎啡的代謝產物 M3G 與 M6G 均有微弱的止痛效力,A,嗎啡確實可引起肥胖細胞脫顆粒，釋放組織胺，這是其引起搔癢和皮疹的機制之一。這種反應是由於嗎啡直接刺激肥胖細胞，導致組織胺釋放，進而引發過敏反應。
鴉片類藥物,8,"104年第20題, 106年第1次第32題, 107年第1次第19題, 107年第3次第19題, 108年第1次第7題, 108年第2次第7題",關於鴉片類藥物的敘述，下列何者最不正確？,Hydromorphone 效力比 morphine 強 3-5 倍（口服），且具有 NMDA 受體拮抗劑與血清素再吸收抑制（serotonin reuptake inhibitor）的特性,Buprenorphine 具有 μ receptor partial agonist 及 κ antagonist 之性質,Meperidine（pethidine）具有高度親脂性，容易引發「尋藥行為」（drug-seeking behavior）,Tapentadol 具有 μ agonist 與 noradrenaline reuptake inhibitor 之性質,以皮下作為給藥路徑可以提供緩慢穩定的吸收，唯給藥量不宜超過 5 mL/hr,A,Hydromorphone雖然效力比morphine強3-5倍，但它不具有NMDA受體拮抗劑與血清素再吸收抑制的特性。這些特性是Methadone的特徵，而非Hydromorphone。
鴉片類藥物,9,"104年第28題, 111年第27題, 114年第14題",關於鴉片類藥物的敘述，下列何者最不正確？,Codeine 在肝臟中經 cytochrome P450 2D6 進行 O-demethylation 後會產生 morphine,Tramadol 屬於 weak opioid 類藥物，口服生物利用率（oral bioavailability）差，對 neuropathic pain 和 fibromyalgia 效用不佳,Tramadol 造成嚴重呼吸抑制的風險極低，但嚴重腎功能障礙或嚴重藥物過量時仍可能發生,Oxycodone 的口服生物利用率比 morphine 高，且比較沒有 active metabolite 的疑慮,肝腎功能障礙對於 methadone 的代謝清除率（clearance）並沒有明顯的影響,B,Tramadol的口服生物利用率約70-80%（相當高），且對神經性疼痛和纖維肌痛症確實有效。它的作用機制包括弱μ受體激動和單胺再吸收抑制，這使其在多種疼痛狀況中有效。
鴉片類藥物,10,105年第11題,類鴉片藥物目前仍是臨床上用於疼痛控制的最主要藥物，以下有關於類鴉片藥物使用之注意事項何者為是?,類鴉片藥物是作用於類鴉片受體而產生止痛作用，各受體間有 Cross tolerance 存在，故使用 opioid rotation 和替代性並不能降低其相關之副作用 並增強其止痛效果。,慢性疼痛病人在使用嗎啡時最擔心的就是所謂的被貼標籤(stigmatization)。,長期使用嗎啡時，其代謝產物 M6G 具有止痛作用，而另一代謝產物 M3G 則會產生副作用。,Buprenorphine 的 first pass 較低，故口服錠效果佳。,Codeine 之主要作用是經由肝臟之 glucuronidation、N-demethylation 和 D-demethylation 而轉化成約 2-10％的嗎啡而產生止痛作用。,C,M6G確實具有強效止痛作用，而M3G主要產生副作用（如興奮、痙攣等），不具止痛效果。這是因為M6G能夠激活μ-opioid受體，而M3G則無此作用。
鴉片類藥物,11,105年第16題,Which one of the following statement is most appropriate?,Morphine can act on µ1 and µ2 opioid receptors.,µ1 opioid receptor can modulate Na+ and Cl- channels via G-protein.,"For human adults, the intrathecal bolus dose of morphine is 3-10 mg.","For human adults, the intrathecal bolus dose of morphine is 3-10 µg.",,A,嗎啡確實可以作用於μ1和μ2鴉片受體亞型。μ1受體主要負責鎮痛和欣快感，而μ2受體則與呼吸抑制、便秘和身體依賴性相關。嗎啡作為非選擇性的μ鴉片受體促效劑，對這兩個亞型都有親和力。這種雙重作用機制解釋了嗗啡既有強效鎮痛作用，同時也會產生相關副作用的原因。
鴉片類藥物,12,105年第40題,Which of the following commonly used opioids has the highest oral bioavailability?,hydromorphone,morphine,pethidine,codeine,methadone,E,Methadone的口服生物利用率約80-95%，在這些選項中最高。這使得methadone在口服給藥時能夠有效地進入系統循環，提供持續的止痛效果，且其長半衰期有助於維持穩定的血藥濃度。
鴉片類藥物,13,105年第42題,Which of the following statement about tramadol is wrong?,Oral tramadol has high bioavailability in the range of 80~90%.,Tramadol has good efficacy for neuropathic pain and fibromyalgia.,The risk for respiratory depression is lower than morphine at equianalgisic doses.,Nausea and vomiting seldom occur in patients with tramadol.,The tramadol is affected by cytochrome P450 2D6 activity.,D,Tramadol實際上經常引起噁心嘔吐，這是其常見副作用之一。這是由於其作用於中樞神經系統的化學感受區，導致胃腸道不適。
鴉片類藥物,14,106年第1次第24題,ORL1 是 opioid receptors 家族中，最後被發現的一種，下列關於它的特性的敘述何者不正確？,別名為 Nociceptin/orphanin FQ,"與其他成員，同樣屬於 G protein-coupled receptor (GPCR), 有 7 個跨膜結構域 (transmembrane domain)",同樣可調控 Ca+2 及 K+離子的通透性，減少神經元的興奮性,對一般的 opioid receptor agonists 的親和力很弱,"此受器的興奮可能出現疼痛過度(hyperalgesia)，出現 ""anti-opioid effect""",E,ORL1（NOP受體）激活通常不會產生hyperalgesia或anti-opioid effect，實際上可能有止痛作用。NOP受體的激活與傳統鴉片受體不同，可能調節疼痛和情緒。
鴉片類藥物,15,106年第1次第25題,關於 下列作用於 opioid receptor 的藥劑，何者不正確？,hydromorphone 是 pure mu agonist，口服劑量的強度是 morphine 的 3-5 倍,"Methadone 是 pure opioid agonist 也是 NMDA receptor antagonist 和 serotonin 的回收抑制劑 (reuptake inhibitor), 常用於戒癮的 maintenance therapy",buprenorphine 是 agonist-antagonist；口服會因 first pass effect 而效果大減,"oxycodone 是半合成的 pure mu opioid agonist, 口服劑量的強度是 morphine 的 1.5-2 倍","Tapentadol 是 mu agonist, 也是 norepinephrine reuptake inhibitor，適合用於神經病變性疼痛",C,Buprenorphine是partial agonist（不是agonist-antagonist），且確實有高度first pass效應，這使得口服效果不佳，通常以舌下或透皮給藥。
鴉片類藥物,16,"107年第1次第23題, 107年第3次第23題, 109年第1次第26題, 109年第2次第26題",Which of the following oral opioids is not recommended for pediatric patients with cancer pain?,morphine,hydromorphone,oxycodone,meperidine (pethidine),all of the above can be prescribed for pediatric patients with cancer pain,D,Meperidine因其代謝產物normeperidine可能引起癲癇和神經毒性，不建議用於兒童癌症疼痛。這些代謝產物在兒童中更容易累積，增加不良反應的風險。
鴉片類藥物,17,"107年第1次第31題, 107年第3次第31題, 110年第41題, 112年第1題","Which of the following drug is categorized as Agonist-Antagonist and should ""Not"" be used in opioid tolerant patients.",Morphine,Tramadol,Nalbuphine,Hydromorphone,Methadone,C,Nalbuphine是混合型致效劑-拮抗劑，可能引發已耐藥病患的戒斷症狀。這是因為它在某些受體上具有拮抗作用，可能會逆轉其他鴉片類藥物的效果。
鴉片類藥物,18,"107年第1次第32題, 110年第43題, 112年第3題","Which of following description about opioid receptors is ""Incorrect"" ?",Opioid receptors belong to the superfamily of G protein–coupled receptors (GPCR),Opioid receptors are coupled to Gs protein to trigger downstream signaling.,Overall opioid receptor activation leads to inhibit neuronal activity,"In spinal cord level, opioid receptors are located mostly in the superficial dorsal horn",Endogenous opiates maybe released by immune cells and work on both central and peripheral opioid receptors.,B,鴉片受體與Gi/Go蛋白偶聯（不是Gs蛋白），抑制adenylyl cyclase活性，這是其抑制神經元活動的主要機制。
鴉片類藥物,19,"108年第1次第10題, 108年第2次第10題, 111年第1題",Which one of the following does not belong to opioid receptor gene family?,MU,DELTA,KAPPA,Cannabinoid receptor,ORL1,D,大麻類受體 (Cannabinoid receptors，包括CB1和CB2) 不屬於類鴉片受體基因家族。它們是獨立的受體家族，與內源性大麻類化合物 (endocannabinoids) 如anandamide和2-AG結合。雖然大麻類受體也參與疼痛調節，但其分子結構、信號傳導途徑和藥理特性與類鴉片受體完全不同。
鴉片類藥物,20,"108年第1次第11題, 108年第2次第11題",Which one of the following is not the common adverse effect of opioid?,Nausea,Agitation,Cognitive impairment,Miosis,Constipation,B,躁動（agitation）不是鴉片類藥物的常見副作用，反而通常具有鎮靜效果。鴉片類藥物通常會引起鎮靜和欣快感，而非興奮。
鴉片類藥物,21,"109年第1次第20題, 109年第2次第20題",Which of the followings is not suggested for the use of opioids for cancer pain in children?,Treat opioid side effects promptly.,Use the transdermal route first in most circumstances.,"If side effects are bothersome with one opioid, consider switching to another one.",Treat constipation pre-emptively.,all of the above should be suggested for prescription of opioids in cancer pain in children,B,兒童癌症疼痛應優先使用口服給藥途徑，經皮給藥不是首選，因為口服給藥更易於調整劑量和監控效果。
鴉片類藥物,22,"109年第1次第38題, 109年第2次第38題",Which of the following suggestion is not advisable for the use of opioids in children with cancer pain?,Use the oral route first in most circumstances,Treat constipation pre-emptively.,"If side effects are bothersome with one opioid, consider switching to another one.",Use sufficient doses to keep the patient comfortable should be avoided due to the possible occurrence of adverse effects,Use the oral route first in most circumstances.,D,應使用足夠劑量確保病患舒適，不應因擔心副作用而避免適當劑量。適當的劑量調整是確保有效止痛和提高生活品質的關鍵。
鴉片類藥物,23,"109年第1次第40題, 109年第2次第40題",有關 Opioid 的敘述，下列何者為錯誤?,Codeine 與 tramadol 皆屬於 weak opioid，但二者不是同一級管制藥。,大約等效止痛劑量換算: 10mg morphine= 50mg tramadol= 7.5mg oxycodone。,Opioid rotation(將一種 opioid 等效換成另一種 opioid)不會改善止痛強度。,Opioid 可能會造成 muscle rigidity，myoclonus 與 delirium。,成癮性 opioid 用於慢性非癌疼痛，在台灣受到嚴格管控。,C,Opioid rotation可以改善止痛強度並減少副作用，因為不完全交叉耐藥性的存在。這種策略有助於克服耐藥性並提高治療效果。
鴉片類藥物,24,111年第13題,下列何者 opioids 及其活性代謝物之血漿半衰期(T1/2)最長？,Morphine,Hydromorphone,Fentanyl,Nalbuphine,levophenol Meperidine 5%,E,Meperidine(哌替啶)及其活性代謝物normeperidine具有最長的血漿半衰期。Meperidine本身的半衰期約3-5小時，但其主要活性代謝物normeperidine的半衰期可達15-40小時，遠超過其他選項。Normeperidine具有神經毒性，長期使用可能導致癲癇等嚴重副作用，這也是為什麼meperidine在慢性疼痛治療中使用受限的原因。
鴉片類藥物,25,"111年第31題, 114年第23題",Which of the following opioid is a μ-Opioid receptor partial agonist?,Oxymorphone,Buprenorphine,Nalbuphine,Pentazocine,Methadone,B,Buprenorphine是μ-opioid受體的部分致效劑（partial agonist），這意味著即使在高劑量下也不會完全激活受體，從而降低了呼吸抑制的風險。
鴉片類藥物,26,111年第33題,Which opioid owns the highest conversion factor to morphine milligram equivalents?,codeine,hydromorphone,oxycodone,morphine,fentanyl transdermal patch (in ug/hr),B,Hydromorphone相對於morphine的換算係數最高（約5:1），表示其效力最強。這使得hydromorphone在需要強效止痛的情況下特別有用。
鴉片類藥物,27,112年第37題,"下列 opioid 中,何者可能產生 QT prolonged, 甚至導致 torsade de pointes 這種致命性心律不整?",Meperidine,Methadone,Tramadol,Buprenorphine,Butorphanol,B,Methadone（美沙酮）是正確答案。Methadone具有雙重藥理作用：作為μ類鴉片受體激動劑提供鎮痛效果，同時阻斷心肌hERG鉀離子通道，影響心室復極化。這種hERG通道阻斷作用會延長動作電位持續時間，表現為心電圖QT間期延長，增加發生torsades de pointes這種多型性心室頻脈的風險。此副作用呈劑量相關性，高劑量使用時風險更高，因此臨床使用需定期心電圖監測。
鴉片類藥物,28,112年第49題,Which of the following descriptions for Transdermal therapeutic system fentanyl (fentanyl-TTS) patches is not correct after application?,a lag time of approximately 2 hours before plasma levels of fentanyl are detected and detected therapeutic levels after 12 to 16 hours,"After system removal, serum fentanyl concentrations decline gradually and has an apparent t1/2 of 17 hours",Prolonged exposure to heat or use in patients who are febrile can cause a toxic overdose,"should not be used in patients who are not opioid-tolerant, for acute pain issues",All of the above are correct descriptions,E,這是正確答案。前面四個選項(A-D)都是關於芬太尼貼片的正確醫學描述，包括其藥物動力學特性、安全注意事項和適應症限制。選項E「以上皆為正確描述」準確總結了這個事實。這種出題方式考查考生是否全面掌握芬太尼貼片的臨床藥理學知識，包括起效時間、清除特性、熱暴露風險，以及適當的患者選擇標準。正確理解這些特性對於安全有效地使用芬太尼貼片進行疼痛管理至關重要。
鴉片類藥物,29,113年第41題,下列鴉片類藥物使用於 severe chronic renal insufficiency 或 hemo/peritoneal dialysis 病患的分類何項正確？,"Hydromorphone -> Preferred, single dose safe","Fentanyl (transdermal) -> Potentially acceptable, use with caution","Morphine (immediate release) -> preferred, single dose safe","Fentanyl (transmucosal, rapid-onset-opioid) -> Avoid use","Oxycodone controlled release (OxyContin) -> preferred, dialysable",B,"經皮fentanyl貼片確實歸類為「potentially acceptable, use with caution」。Fentanyl主要經肝臟代謝，不產生活性代謝物，且高蛋白結合率使其較不受腎功能影響。然而，腎衰竭病患的藥物敏感性可能改變，皮膚狀況也可能影響藥物吸收，因此需要謹慎使用。透析對fentanyl清除效果有限，但整體而言是腎衰竭病患相對安全的長效鴉片類選擇，前提是適當監測和劑量調整。"
鴉片類藥物,30,114年第35題,Which of the substances delivered spinally can not reverse or block antinociceptive tolerance as well as opioid-induced hyperalgesia?,NMDA receptor antagonists,phosphokinase C inhibitors,cyclo-oxygenase inhibitors,5-HT3 receptors antagonist,differing opioid receptor subtype agonists/antagonists,D,5-HT3受體拮抗劑不能逆轉或阻斷鴉片類藥物的止痛耐受性和鴉片誘發性痛覺過敏。這些拮抗劑主要用於治療噁心和嘔吐，而非疼痛調控。
鴉片類藥物,31,114年第36題,Which description below for opioids is wrong?,opioid receptors are G protein related receptor complexes,Spinal effects arising from supraspinal actions of μ-opioid receptors agonists are via descending GABA receptor activation,μ-opioid receptors agonists act presynaptically on primary afferents to inhibit release of excitatory neurotransmitters,μ-opioid receptors agonists act postsynaptically to directly inhibit second-order neurons,All of the above description for opioids are all correct,B,這是錯誤的敘述，也是正確答案。μ-鴉片受體激動劑的脊髓上作用主要是透過激活腦幹的下行抑制通路，特別是藍斑核(locus coeruleus)的正腎上腺素系統和中縫核(raphe nuclei)的血清素系統，而非透過下行的GABA受體激活。這些下行通路在脊髓背角釋放noradrenaline和serotonin來抑制疼痛傳導。
成癮與藥物轉換,1,"102年第14題, 104年第38題, 105年第28題, 106年第1次第11題, 107年第1次第5題, 107年第3次第5題, 108年第1次第5題, 108年第2次第5題, 113年第24題",當病人一再來門診或急診要求注射成癮性止痛藥時，下列哪些現象暗示病患可能有「成癮」現象？,病人抱怨最近的處方的止痛時間不夠久，藥效變差,病人抱怨最近疼痛加重厲害，發作頻繁，他把三天的藥一天吃完,病人自述出現嗜睡、噁心、性欲降低、便秘，但是疼痛都沒有減輕,病人自述沒吃止痛藥會睡不著，希望睡前加重劑量輔助睡眠,病人最近反覆敘述藥物遺失，而且發生很多次,E,反覆聲稱藥物遺失是典型的藥物成癮行為。這種drug-seeking behavior暗示病患可能為了獲得額外藥物而編造理由，顯示失去控制能力和欺騙行為。正常使用止痛藥的患者很少會repeatedly lose medication。這種pattern strongly suggests addiction，特別是當遺失頻繁發生時。醫療人員應該建立更嚴格的監管措施，考慮addiction evaluation和treatment modification。
成癮與藥物轉換,2,"102年第32題, 103年第25題, 104年第47題","When the administration of opioids failed to manage pain or the dose of opioids are noted to escalate, the following differential diagnosis should be considered, except:",Limited absorption of oral preparations—vomiting or gastric stasis,Pain poorly responsive to opioids alone- such as Neuropathic pain,Pharmacological factors: Opioid-induced hyperalgesia and allodynia,"Psychological factors: Distress, Anxiety or Depression",All of the above should be considered,E,題目問的是「除了...之外」，而所有列出的因素（吸收問題、對鴉片反應差的疼痛、鴉片誘發痛覺過敏、心理因素）都應該被考慮。這些因素可能導致疼痛管理失敗或劑量增加，反映出疼痛的多面性和複雜性，需全面評估以制定適當的治療計劃。
成癮與藥物轉換,3,"104年第11題, 105年第10題",關於嗎啡類藥物成癮的機轉敘述，下列何者錯誤：,大腦中 ventral tegmental area (VTA) 及 nucleus accumbens (NA)為最重要影響腦區,此兩個腦區藉由系統中的 mesolimbic pathway 連接,與神經傳遞物血清素(serotonin)的分泌有關,此中樞神經網路代表了動物行為的「獎懲系統」(reward system),與酒精成癮的機制是同一套神經興奮系統,C,鴉片類藥物成癮主要與多巴胺(dopamine)系統有關，不是血清素系統。多巴胺在VTA和NA之間的傳遞是成癮行為的核心機制，這個系統的活化會增強獎勵效應，促使重複使用藥物。
成癮與藥物轉換,4,"105年第15題, 106年第1次第43題, 111年第49題",下列關於 opioid rotation 或 opioid switch，哪一種敘述較不正確：,opioid switch/rotation 意思是指改變鴉片藥物的給藥途徑，可以提高止痛效果,動物實驗上可發現，鴉片受器剔除小鼠仍可以保留部分對 fentanyl 注射的止痛效果,理論基礎是基於人體對 opioid receptor 的 binding profile 及 affinity 具有基因多樣性 (heterogenecity),臨床上已成為改善癌症病人的嗎啡類藥物效果的常用方式,tramadol 換成 morphine 不能稱為 opioid switch,A,Opioid rotation/switch是指更換不同種類的鴉片類藥物，不是改變給藥途徑。這種策略是為了克服耐受性或副作用，通過利用不同藥物的受體結合特性來改善止痛效果。
成癮與藥物轉換,5,105年第19題,Choose one wrong description about opioid use:,Acute opiate administration activated opiate receptors in central and peripheral nervous system,Protein kinase A (PKA) and CREB were also activated after opiate administration,Repeatedly seeking opioid from other clinicians is a more predictive addiction indicator,Requesting specific drugs is a more predictive addiction indicator,Aggressive complaining about needing more drug is a less predictive addiction indicator,D,要求特定藥物不一定是成癮的強烈指標，病人可能基於過往治療經驗或醫師建議而有偏好。這種行為可能反映病人對某種藥物的良好反應，而非成癮行為。
