Category,QuestionNumber,ExamRecord,Question,A,B,C,D,E,Answer,Explanation
脊髓損傷截肢與CRPS,1,102年第1題,Which of the following is the unacceptable statement about peripheral nerve block?,Post-amputation pain can be easily treated by analgesia,Phantom pain may enhance with time,Phantom pain is the painful sensations referred to the amputation stump,Pre-amputation pain increases the risk of phantom pain,Phantom pain can be prevented by a preoperative epidural blockade,C,此選項是正確答案，因為它對phantom pain的定義是錯誤的。Phantom pain（幻肢痛）是指患者感受到已被截除肢體部位的疼痛感覺，而非「疼痛感覺指向截肢殘肢（amputation stump）」。選項C實際上描述的是stump pain（殘肢痛）的概念。Stump pain是指殘存肢體組織的實際疼痛，可能由於手術切口癒合不良、感染、神經瘤形成或義肢不適合等原因造成。相對地，phantom pain是一種神經病理性疼痛，患者會感覺到「不存在的肢體」仍然存在並且疼痛，這種感覺可能包括刺痛、燒灼感、壓迫感等。正確區分這兩種疼痛類型對於臨床診斷和治療選擇具有重要意義，因為它們的病理機轉和治療方法完全不同。
脊髓損傷截肢與CRPS,2,102年第4題,Choice a right description about limb pain after surgery:,Phantom pain is experienced only about 5-10% of cases.,Phantom pain may initially magnify but seldom fade over time.,Neural blockade has no effect on the incidence of phantom limb pain.,Stump pain is usually the result of neuroma at the site of nerve transection and characterized by dysesthesia.,None of above is right,D,殘肢痛通常是由於神經橫斷處形成神經瘤，這些神經瘤會導致異常的感覺，如感覺異常或疼痛。這種疼痛是由於神經末梢的異常再生和過度興奮所致，常伴隨著局部的感覺異常。
脊髓損傷截肢與CRPS,3,"103年第35題, 104年第14題","Which of the following statement concerning ""phantom limb pain"" is most likely:",Phantom pain is the painful sensations referred to the amputation stump,Phantom pain may enhance with time,Preamputation pain increases the risk of phantom pain,Phantom pain can be prevented by a preoperative epidural blockade,Postamputation pain can be easily treated by analgesia,C,截肢前的疼痛經驗確實會增加幻肢痛的風險，這是因為中樞神經系統可能已經對疼痛形成了記憶，並在截肢後持續影響患者的疼痛感知。
脊髓損傷截肢與CRPS,4,"108年第1次第17題, 108年第2次第17題",A patient with recent leg amputation presents with pain at the site of the stump. Which of the following statements about stump pain is FALSE?,The incidence of severe pain is probably seen in only 5-10% of cases.,It is present in the majority of patients with phantom pain.,It is present in the first week after amputation and always subsides with surgical healing.,It can be associated with sensory abnormalities.,All of the above are true.,C,殘肢痛並不是總是會隨著手術癒合而消失，可能會持續存在，特別是在神經瘤形成或中樞神經系統重組的情況下。
脊髓損傷截肢與CRPS,5,"109年第1次第13題, 109年第2次第13題, 111年第22題",治療 Postamputation pain 下列用藥，何者最不適合？,Imipramine,Gabapentine,Pregabalin,Memantine,Tramadol,D,Memantine主要用於治療阿茲海默症，其在截肢後疼痛的應用證據有限，因此不是首選藥物。其機制主要涉及NMDA受體拮抗，但在幻肢痛的治療中效果不明顯。
脊髓損傷截肢與CRPS,6,112年第14題,對於幻肢痛的預防與治療下列何者為正確？,周術期使用硬膜外注射、周邊神經導管止痛等等方式可完全避免幻肢痛,若發生僅需選擇一種病患認為最有效的治療即可，無須使用多模式治療,抗憂鬱藥、抗癲癇藥、opioid 與 ketamine 都是藥物治療的選項,脊隨神經刺激器(SCS)，用於幻肢痛完全沒效果,生物回饋(Biofeedback)，是行為治療的方式之一，但也幾乎完全無效,C,這些藥物確實都是幻肢痛治療的選項，包括三環抗憂鬱劑、抗癲癇藥、鴉片類藥物和NMDA受體拮抗劑ketamine。這些藥物通過不同的機制作用於中樞和外周神經系統，幫助減輕疼痛。
脊髓損傷截肢與CRPS,7,102年第48題,一個因外傷而將左下腳(left lower leg)截肢的 15 歲少年，最後發展 phanton pain (幻肢痛)，雖經多種方法止痛，仍未獲得疼痛舒緩，因此接受脊椎神經刺激術(spinal cord stimulation)，請問應放在哪一個脊椎範圍為佳？,頸椎位置,中至下頸椎位置,上至中胸椎位置,中至下胸椎位置,腰椎位置,D,左下腿截肢的幻肢痛，脊髓刺激電極應放置在T10-T12的位置，以涵蓋下肢的感覺皮節。這是因為幻肢痛涉及下肢的感覺神經，這些神經在脊髓的中至下胸椎段進入脊髓。脊髓神經刺激術透過調節這些區域的神經活動，可能有助於減少幻肢痛的強度和頻率。
脊髓損傷截肢與CRPS,8,103年第41題,下列有關 Phantom pain 的敘述何者正確？,所有截肢病患都會出現 Phantom pain,常見 Telescoping phenomenon（患肢感覺 shrinkage，甚至縮進 stump 內）,早期給予大劑量強效嗎啡止痛，可以降低 Phantom pain 發生機率,"病人若出現 radiating, lancinating or paroxysmal pain，首選治療藥物是大劑量 Gabapentin，可從每天 1200mg 作為起始劑量","Physical therapy 例如 massage, manipulation 或 acupuncture, hypnosis 等整合療法對 Phantom pain 無效",D,此選項基本正確。對於神經性疼痛特徵的幻肢痛（如放射性、刺痛或陣發性疼痛），Gabapentin確實是首選治療藥物之一。Gabapentin是抗癲癇藥物，對神經性疼痛有良好療效。雖然臨床上起始劑量通常較保守（如300mg/day），但在某些嚴重病例中，經驗豐富的疼痛專科醫師可能會使用較高的起始劑量。重要的是要根據病患反應調整劑量，監控副作用。
脊髓損傷截肢與CRPS,9,"102年第18題, 103年第8題, 104年第7題, 106年第1次第29題, 106年第1次第49題, 107年第1次第17題, 107年第1次第29題, 107年第3次第17題, 107年第3次第29題, 108年第1次第23題, 108年第1次第45題, 108年第2次第23題, 108年第2次第45題, 109年第1次第28題, 109年第2次第28題, 110年第19題, 111年第4題",Pain is a frequent consequence of spinal cord injury (SCI). Which of the following statement is least likely:,Below-level neuropathic pain is most likely described as severe or excruciating months or years following initial injury.,Damage to the spinothalamic tracts is an important ingredient in the development of neuropathic pain following SCI.,Chronic musculoskeletal pain is common in tetraplegic patients after SCI.,Patients with cervical SCI are at risk of developing CRPS affecting upper limbs.,Below-level neuropathic pain is also referred to deafferentation pain.,C,此敘述錯誤，為正確答案。四肢癱瘓(tetraplegia)患者是指頸椎脊髓損傷導致四肢功能受損，但上肢通常仍保有部分功能。由於四肢癱瘓患者主要使用輪椅移動，上肢承擔大部分日常活動負荷，容易發生肩部、手腕等部位的過度使用症候群，因此慢性肌肉骨骼疼痛在四肢癱瘓患者中是常見的，而非不常見。
脊髓損傷截肢與CRPS,10,103年第19題,Choice a wrong description about pain following spinal cord injury (SCI):,Pain exists only at the level or below the level of injury cord.,The pain after SCI was composed of both nociceptive and neuropathic pain.,Psychological issues have tremendous importance in the expression of pain.,Tricyclic antidepressants may be effective for neuropathic SCI pain.,Clonidine administered spinally play some roles for SCI pain,A,脊髓損傷後的疼痛可以發生在損傷平面以上、平面處或平面以下，不僅限於損傷平面處或以下。這是因為損傷可能導致廣泛的神經系統改變，包括中樞神經系統的重組和周圍神經的異常活動。
脊髓損傷截肢與CRPS,11,"102年第28題, 103年第20題",Which of the following treatment is NOT the indication for limbs pain induced by increased spasticity after C7 incomplete spinal cord injury?,Joint positioning and range-of-motion (ROM) exercises.,"Treat underlying spasticity-triggering events (infection, pressure ulcer, etc).",Serial casting or dynamic splinting to relieve already-occurred contractures.,"Oral narcotics, like codeine or tramadol.","Anti-spasticity blocks via Botulinum toxins, phenol, or ethanol.",D,口服鴉片類藥物對痙攣引起的疼痛效果有限，且可能增加便秘等副作用，不是首選治療。這些藥物主要針對急性疼痛，而痙攣引起的疼痛通常需要針對痙攣本身進行治療。
脊髓損傷截肢與CRPS,12,"107年第1次第49題, 107年第3次第49題",Which of the following sign/ or symptom after spinal cord injury with its management is not suggested?,muscle spasm with oral baclofen,hypertension due to autonomic dysreflexia with antihypertensive drugs,at/ below level neuropathic pain with pregabalin,at/ below level neuropathic pain with duloxetine,pain due to fracture/ dislocation with NSAUDs,D,Duloxetine對脊髓損傷後神經病理性疼痛的證據有限，雖然它在其他神經病理性疼痛中可能有效，但在SCI患者中的應用尚未充分證實。NSAIDs對骨折脫位疼痛有效，但可能影響骨癒合，因此在某些情況下需謹慎使用。
脊髓損傷截肢與CRPS,13,102年第37題,下列有關 spinal cord injury (SCI)之後引起之疼痛，下列敘述，何者較不正確？,慢性 SCI 疼痛，大約佔 SCI 之 65％,慢性 SCI 疼痛病人當中，大約有 1/3 病人具有嚴重疼痛,可區分為 musculoskeltal pain，visceral pain 以及 nreuropathic pain (above-level pain、at-level、below-level),其中以 neuropathic pain 最常見，約佔慢性 SCI pain 之 58％,一般而言，眾多藥物及治療方式當中，較難有長時間而滿意的止痛療效,D,肌肉骨骼疼痛是最常見的SCI慢性疼痛類型，而非神經病理性疼痛。根據研究，神經病理性疼痛在SCI患者中雖然常見，但肌肉骨骼疼痛仍然是最普遍的，這可能是由於長期的姿勢不良和活動受限所致。神經病理性疼痛通常與神經損傷後的異常神經傳導有關，但在SCI患者中，肌肉骨骼疼痛更為普遍。
脊髓損傷截肢與CRPS,14,114年第41題,"Spinal cord injury (脊髓損傷, SCI )病人若伴隨 abdominal visceral pain，於 SCI 發生後幾年，其頻率最高?",3 年,5 年,10 年,20 年,30 年,D,SCI後腹部內臟疼痛的頻率在損傷後約20年達到最高峰，這可能與長期的神經系統變化和並發症有關。隨著時間的推移，神經系統的適應性改變可能導致內臟痛覺的增強，這也可能與慢性炎症和內臟器官的功能改變有關。這些變化可能在20年後達到一個臨床上顯著的程度。
脊髓損傷截肢與CRPS,15,114年第42題,"Spinal cord injury (脊髓損傷, SCI )病人若伴隨有 spasticity，下列何種藥物使用會降低 seizure threshold，尤其當病人伴隨有 seizure 問題時要特別注意?",Acetaminophen,NSAIDs,Tramadol,Baclofen,SNRIs drugs,D,Baclofen會降低癲癇閾值，特別是在有癲癇病史的患者中需要特別小心使用。Baclofen是一種GABA_B受體激動劑，主要用於治療痙攣，但其降低癲癇閾值的作用可能與其對中樞神經系統的抑制作用有關，這可能增加癲癇發作的風險。
脊髓損傷截肢與CRPS,16,102年第33題,Which of the following statement concerning the complex regional pain syndromes (CRPS) is least likely:,"CRPS is characterized by pain, abnormal regulation of blood flow and sweating, as well as tropic changes of skin and subcutaneous tissues.",Reflex sympathetic dystrophy (RSD) usually develops after injury to a major peripheral nerve.,RSD is also called CRPS type I.,"In addition to positive sensory phenomena, up to 50% of patients with chronic CRPS type I develop hypoaesthesia and hypoalgesia on the entire half of the body.","Spontaneous pain or allodynia/hyperalgesia occurs, which is not limited to the territory of a single peripheral nerve in patients with CRPS type I.",B,RSD (CRPS type I) 通常在沒有明確神經損傷的情況下發生，而不是在主要周邊神經損傷後發生。CRPS type I的特徵是疼痛和自主神經功能障礙，通常在輕微創傷或無明顯誘因下發生，這與CRPS type II不同，後者需要有明確的神經損傷。
脊髓損傷截肢與CRPS,17,"102年第44題, 104年第46題",Which statement regarding complex regional pain syndrome (CRPS) is True?,"Causalgia, or burning pain, is now categorized as CRPS type I.","The term ""reflex sympathetic dystrophy"" (RSD), or CRPS type II, refers to a syndrome similar to causalgia but with a specific nerve lesion.",Etiology involve only peripheral over-reactions after nerve and/or soft tissue damage.,"The signs and symptoms in CRPS are heterogeneous; which reflect underlying sensory, autonomic, and motor dysfunctions.",Sympathetic blockade is the golden standard of treatment,D,CRPS的症狀和徵象確實是異質性的，反映了潛在的感覺、自主神經和運動功能障礙。這種異質性可能是由於多種病理生理機制的交互作用，包括中樞和周邊神經系統的改變，以及自主神經系統的失調。
脊髓損傷截肢與CRPS,18,102年第46題,下列有關 Complex regional pain syndrome(CRPS)的敘述何者不正確？,骨折後，發展成為 CRPS I 的 incidence 約為 1-2%。,女性比男性更容易發生 CRPS。,CRPS typeII 病患其通常進展為其有非對稱性遠端肢體疼痛及腫脹但並沒有神經損傷。,CRPS 病患有相當高比例，同時罹患憂鬱症及焦慮、症。然而目前並沒有證據顯示 CRPS 是種心因性問題。,有50%慢性CRPS I病人在半邊身體或患肢同側上方發展為hypoaesthesia及hypoalgesia。,C,CRPS type II的定義是有神經損傷的證據，而非沒有神經損傷。沒有神經損傷的是CRPS type I。CRPS type II通常伴隨明確的神經損傷，如神經切斷或壓迫，這與CRPS type I的病理機制不同。
脊髓損傷截肢與CRPS,19,"103年第7題, 104年第23題",Which neurological signs and symptoms of complex regional pain syndrome (CRPS) among the followings is the highest?,Hyperesthesia/allodynia,Coordination deficits,Tremor,Muscle spasm,Paresis,A,Hyperesthesia和allodynia是CRPS的核心症狀，這些症狀反映了患者對刺激的過度敏感，通常是由於中樞神經系統的過度興奮和周邊神經的異常反應所致。Paresis（輕癱）則是CRPS中常見的運動症狀，可能由於長期疼痛導致的運動功能受限或神經損傷引起。
脊髓損傷截肢與CRPS,20,103年第18題,Choice a wrong description about complex regional pain syndrome (CRPS):,CRPS I develop more often than CRPS II,"CRPS is characterized by pain, abnormal regulation of blood flow and sweating, edema of skin and subcutaneous tissue.",Sympathetic paravertebral ganglia blockade has no effect on CRPS.,Transcutaneous electrical nerve stimulation (TENS) may be effective in some cases.,Epidural spinal cord stimulation has shown efficacy in some cases,C,交感神經椎旁神經節阻斷在某些CRPS患者中是有效的，尤其是那些有sympathetically maintained pain的患者，這種治療可以減少交感神經系統對疼痛的維持作用。
脊髓損傷截肢與CRPS,21,"108年第1次第18題, 108年第2次第18題",Which patient with complex regional pain syndromes (CRPS) is most likely to have the worst outcome?,Patient who had a fracture leading to CRPS,Patient who had a nerve injury in the lower extremity with warm CRPS,Patient who had a nerve injury in the upper extremity with cold CRPS,Patient who had a nerve injury in the upper extremity with warm CRPS,Patient who has depression disorder,C,上肢神經損傷合併cold CRPS的患者通常預後最差，因為cold CRPS常代表疾病的嚴重性和慢性化，這可能與交感神經系統的過度活動和局部血流減少有關。
脊髓損傷截肢與CRPS,22,"107年第1次第48題, 107年第3次第48題",Which of the following is not a common sign or symptom in complex regional pain syndrome (CRPS)?,Mechanical hyperalgesia,Vasodilatation or Vasoconstriction,Swelling,hyperhidrosis or hypohydrosis,all of the above can be clinical signs or symptoms associated with CRPS,E,所有列出的症狀和徵象都是CRPS的常見表現，這些症狀反映了CRPS的多系統影響，包括感覺過敏、血管運動異常、組織水腫和出汗異常，這些都與自主神經系統的失調有關。
脊髓損傷截肢與CRPS,23,"105年第25題, 110年第4題, 114年第48題",Which of the following diagnostic tests that aid in the diagnosis of complex regional pain syndrome?,Bone scintigraphy,Plain radiography and X-ray bone densitometry,Quantitative sensory testing,Skin temperature measurement,All of above,E,「All of above」是正確答案，因為所有列出的檢查都對CRPS診斷有幫助。CRPS是一個complex multisystem disorder，涉及sensory、motor、autonomic和inflammatory abnormalities。沒有單一gold standard test可確診CRPS，診斷主要依靠clinical criteria。然而，bone scintigraphy、plain radiography、QST和temperature measurement都能提供valuable supporting evidence，幫助確診、排除其他疾病、characterize disease severity，並monitor treatment response。綜合運用這些檢查工具可提高診斷準確性。
脊髓損傷截肢與CRPS,24,112年第12題,"關於複雜性疼痛症候群(Complex Regional Pain Syndrome, CRPS)之診斷下列敘述何者不恰當？",使用 1994 IASP criteria 敏感性很低常會造成 false negative,thermography 或 bone scan 等檢查可提供客觀的臨床證據，但並非診斷的必要條件,診斷 CRPS 主要依靠臨床診斷,目前主流診斷依據為 Budapest Criteria,Budapest Criteria 以感覺、血管收縮、催汗與水腫、運動與營養等四項分為徵候與症狀做為臨床診斷表準,A,此選項是錯誤的敘述，因此為正確答案。1994年IASP criteria實際上敏感性很高，容易造成過度診斷(false positive)，而非敏感性低造成漏診(false negative)。該標準的問題在於特異性不足，導致許多不是CRPS的患者被誤診為CRPS。這正是後來發展Budapest Criteria的主要原因，目的是在維持高敏感性的同時提高特異性，減少偽陽性診斷的發生。
脊髓損傷截肢與CRPS,25,112年第16題,關於複雜性局部疼痛之藥物治療考量下列何者錯誤？,"significant osteopenia, trophic change 可使用 calcitonin 或 bisphosphonates",發炎與水腫可長期慢性使用 corticosteroids,嚴重輕觸痛(allodynia)或痛覺敏感(hyperalgesia)可使用 Gabapentin,profound vasomotor disturbance 可考慮使用鈣離子阻斷劑治療,憂鬱焦慮與失眠可使用鎮定劑治療,B,Corticosteroids不應長期慢性使用，因為長期使用會導致嚴重的副作用，如骨質疏鬆、糖尿病、免疫抑制等。這些副作用可能會加重患者的病情，因此在CRPS的治療中，corticosteroids通常僅限於短期使用以控制急性發炎和水腫。
脊髓損傷截肢與CRPS,26,113年第27題,"依據 2012 年 IASP 布達佩斯診斷標準(Budapest Diagnostic Criteria)定義的「複雜性局部疼痛症候群」(complex regional pain syndrome, CRPS)，下列何者錯誤：",為局部性的持續性疼痛，大部分為侷限於某神經皮節或特定的神經支配區域,異常的表現，包括感覺性、運動性、流汗性 (sudomotor)、血管性(vasomotor)、及營養性 (trophic) 等變化,疼痛的程度，會與原本造成傷害的疾病或病變應有的正常強度表現，不成比率,布達佩斯標準中，不需要區分第一型或第二型 CRPS,布達佩斯標準中，對臨床診斷及研究型診斷有不同的標準,A,根據2012年IASP布達佩斯診斷標準，CRPS的疼痛特徵是「局部性的持續性疼痛，但不局限於某一特定神經支配區域」。這是CRPS的重要特徵，疼痛分布會超越單一神經皮節或特定神經支配範圍，呈現不尋常的疼痛分布模式。選項A錯誤地描述疼痛大部分侷限於某神經皮節或特定神經支配區域，這與CRPS的實際臨床表現不符。
脊髓損傷截肢與CRPS,27,113年第29題,"有關「複雜性局部疼痛症候群」(complex regional pain syndrome, CRPS)的敘述，下列何者錯誤？",CRPS type I (又稱 reflex sympathetic dystrophy) 指的是沒有神經受損的證據,CRPS type II (又稱 causalgia) 指的是有神經受損的證據,診斷主要依據臨床症狀及理學檢查，並排除其他可能診斷,藥物治療包括抗憂鬱劑、抗癲癇藥物、非類固醇消炎藥、及鴉片類藥物等,交感神經阻斷術(sympathetic block)對於所有CRPS病患皆有效,E,"此選項敘述錯誤，為本題正確答案。交感神經阻斷術（sympathetic block）對CRPS患者並非100%有效，這是一個重要的臨床事實。雖然交感神經系統功能異常被認為是CRPS病理生理機制的重要組成部分，但臨床研究顯示，僅約30-50%的CRPS患者對交感神經阻斷術有良好反應。根據對交感神經阻斷術的反應，CRPS可分為交感神經維持性疼痛（sympathetically maintained pain, SMP）和交感神經無關性疼痛（sympathetically independent pain, SIP）。對於SMP患者，交感神經阻斷術可能有效；但對於SIP患者，此治療方法效果有限。因此，交感神經阻斷術應被視為診斷性和治療性的工具，但不是對所有患者都適用的萬能治療方法。臨床上需要個體化評估每位患者的反應。"
脊髓損傷截肢與CRPS,28,111年第37題,下列有關 complex regional pain syndrome (CRPS)的 interventional therapies 敘述何者正確?,Sympathetic block 目前被認為是 CRPS 第一線的標準介入性治療,"由於 CRPS 皆有 sympthetically maintained pain (SMP), 因此 systemic infusion of sympatholytic agent (例如 phentolamine)具有很好的療效","目前實證醫學證據顯示針對下肢的 CRPS, spinal cord stimulation 比 dorsal root ganglion stimulation 的療效更佳","相較於 conservative treatment, spinal cord stimulation 於 CRPS 的療效目前已有 prospective randomized controlled trial 證實",以上皆正確,D,確實有前瞻性隨機對照試驗證實脊髓刺激術對CRPS比保守治療更有效，這些研究顯示脊髓刺激術能顯著減少疼痛並改善患者的生活品質，特別是在傳統治療無效的情況下。
脊髓損傷截肢與CRPS,29,103年第42題,下列有關脊髓損傷後的慢性疼痛之敘述何者錯誤？,脊髓損傷節段以下由於已無知覺，因此不會有疼痛感覺，脊髓損傷後的慢性疼痛都是 at-level neuropathic pain,脊髓損傷後的慢性疼痛常合併有重度憂鬱等的情緒面向,脊髓損傷後的慢性疼痛依舊可以使用脊椎內嗎啡幫浦作為止痛處置，然常效果不盡理想，需要合併給予如 clonidine 等輔助性藥物,心理諮商訪談及認知行為療法是脊髓損傷後的慢性疼痛常用且效果顯著的治療,脊髓損傷後的慢性疼痛不全然是 Neuropathic，有部分是 chronic musculoskeletal pain,A,此選項錯誤。脊髓損傷後的慢性疼痛不僅限於at-level neuropathic pain。即使在損傷節段以下，患者仍可能經歷below-level neuropathic pain(節段下神經病理性疼痛)。這種疼痛可能源自於脊髓損傷後的中樞敏感化機制、殘存神經纖維的異常放電、或類似幻肢痛的現象。完全性脊髓損傷患者在理論上雖然失去損傷節段以下的感覺，但臨床上確實可能出現節段下疼痛，這是脊髓損傷疼痛管理中的重要臨床現象。
介入性治療,1,"102年第2題, 103年第1題, 104年第10題, 106年第1次第46題, 108年第1次第42題, 108年第2次第42題, 109年第1次第50題, 109年第2次第50題, 110年第13題, 112年第38題, 114年第45題","About image-guided lumbar sympathetic block, which the following indication is not proper?",Sympathetically maintained pain,Reflex sympathetic dystrophy,Phantom low limb pain,Raynaud's disease,Chronic pancreatitis,E,慢性胰臟炎引起的疼痛主要由內臟神經支配，這類疼痛通常需要腹腔神經叢阻斷(celiac plexus block)來達到有效的疼痛控制，而非腰部交感神經阻斷。腹腔神經叢阻斷能夠直接影響支配胰臟的神經，減少疼痛傳導，這與腰部交感神經阻斷的作用範圍不同。
介入性治療,2,"102年第9題, 104年第17題, 106年第1次第48題, 107年第1次第28題, 107年第3次第28題, 108年第1次第12題, 108年第2次第12題, 109年第1次第9題, 109年第2次第9題, 110年第18題","About epidural steroid injection, which one of following statements is wrong?",Spinal stenosis is an indication for epidural steroid.,Do not use for non-specific low back pain.,Do not repeat more than three times per year.,May cause pain from chronic arachnoiditis.,Efficacy is less with radicular pain that has lasted longer than 3 months.,A,脊椎狹窄症不是硬脊膜外類固醇注射的主要適應症，因為其主要病因是機械性壓迫，而非發炎性神經根病變。硬脊膜外類固醇注射主要用於減少發炎和神經根壓迫引起的疼痛，而在脊椎狹窄中，類固醇的抗炎效果對於機械性壓迫的緩解有限。
